{
  "$schema": "https://json-schema.org/draft/2020-12/schema",
  "$id": "https://github.com/123xiaoxin/master-orchestrator/schemas/verify_repair_loop.v1.schema.json",
  "title": "Verify Repair Loop v1",
  "description": "Bounded verify/repair loop contract for revalidation after failed checks. Limits repair to 2 rounds and requires revalidation after each repair. Used by the Harness Layer to prevent infinite retry loops.",
  "type": "object",
  "additionalProperties": false,
  "required": [
    "schemaVersion",
    "target",
    "verifyStep",
    "expectedSignal",
    "status",
    "attempt",
    "maxAttempts",
    "attempts",
    "nextAction",
    "updatedAt"
  ],
  "properties": {
    "schemaVersion": {
      "const": "verify_repair_loop.v1"
    },
    "target": {
      "type": "string",
      "minLength": 1
    },
    "verifyStep": {
      "type": "object",
      "additionalProperties": false,
      "required": [
        "command",
        "scope"
      ],
      "properties": {
        "command": {
          "type": "string",
          "minLength": 1
        },
        "scope": {
          "type": "string",
          "minLength": 1
        }
      }
    },
    "expectedSignal": {
      "type": "string",
      "minLength": 1
    },
    "status": {
      "enum": [
        "pending_verification",
        "verification_failed",
        "repair_in_progress",
        "repaired",
        "verification_passed",
        "exhausted",
        "needs_user_decision"
      ]
    },
    "attempt": {
      "description": "Current in-progress or just-completed repair round.",
      "type": "integer",
      "minimum": 0,
      "maximum": 2
    },
    "maxAttempts": {
      "description": "Maximum allowed repair rounds.",
      "const": 2
    },
    "attempts": {
      "description": "Recorded repair attempts. attempts.length is the number of recorded repair attempts.",
      "type": "array",
      "items": {
        "type": "object",
        "additionalProperties": false,
        "required": [
          "attempt",
          "failureReason",
          "repairAction",
          "result"
        ],
        "properties": {
          "attempt": {
            "type": "integer",
            "minimum": 1
          },
          "failureReason": {
            "type": "string",
            "minLength": 1
          },
          "repairAction": {
            "type": "object",
            "additionalProperties": false,
            "required": [
              "summary",
              "changedFiles"
            ],
            "properties": {
              "summary": {
                "type": "string",
                "minLength": 1
              },
              "changedFiles": {
                "type": "array",
                "items": {
                  "type": "string",
                  "minLength": 1
                }
              }
            }
          },
          "result": {
            "enum": [
              "repair_applied",
              "verification_passed",
              "verification_failed",
              "needs_user_decision",
              "exhausted"
            ]
          },
          "notes": {
            "type": "string"
          }
        }
      }
    },
    "nextAction": {
      "type": "string",
      "minLength": 1
    },
    "updatedAt": {
      "type": "string",
      "format": "date-time"
    }
  },
  "examples": [
    {
      "schemaVersion": "verify_repair_loop.v1",
      "target": "Repository encoding guardrail",
      "verifyStep": {
        "command": ".\\scripts\\check_encoding.ps1",
        "scope": "Repository text files covered by the encoding guardrail"
      },
      "expectedSignal": "OK encoding check passed",
      "status": "verification_passed",
      "attempt": 0,
      "maxAttempts": 2,
      "attempts": [],
      "nextAction": "No further action needed. Verification passed.",
      "updatedAt": "2026-06-17T10:05:00Z"
    }
  ]
}
